{
  "receipt_id": "dr_20260526_firewall_discount_revise_001",
  "standard": "neura-decision-receipt-v0.1-draft",
  "created_at": "2026-05-26T16:05:00-04:00",
  "action_card_id": "ac_20260526_firewall_discount_001",
  "decision": "revise",
  "decision_reason": "Requested discount exceeds the synthetic merchant policy limit; agent may revise to the approved limit before review.",
  "actor": {
    "type": "agent",
    "name": "Agent Action Firewall Demo Agent",
    "runtime": "local_dry_run"
  },
  "proposed_action": {
    "action_type": "create_discount_code",
    "target": "customer:CO-CUST-204",
    "summary": "Create a 35 percent discount code for a synthetic customer recovery workflow.",
    "params_hash": "sha256:firewall_discount_001",
    "amount_or_value_at_risk": "35 percent discount",
    "customer_impact": "customer receives an excessive discount offer"
  },
  "risk": {
    "risk_class": "commercial_commitment",
    "consequence_score": 2
  },
  "policy_basis": [
    {
      "policy_ref": "commerceops.synthetic.discounts.max_without_review",
      "summary": "Discounts above 20 percent require revision or merchant-owner review."
    }
  ],
  "evidence_basis": [
    {
      "evidence_ref": "customer:CO-CUST-204.recovery_context",
      "summary": "Synthetic customer recovery context exists, but does not justify the requested discount level."
    }
  ],
  "authority": {
    "authority_ref": "merchant_owner",
    "approval_state": "revision_required",
    "required_role": "owner_or_operator"
  },
  "validity": {
    "valid_for_action_type": "create_discount_code",
    "valid_for_target": "customer:CO-CUST-204",
    "params_hash": "sha256:firewall_discount_001",
    "valid_until": null,
    "invalid_if_changed": [
      "action_type",
      "target",
      "params_hash",
      "actor",
      "policy_refs",
      "evidence_refs",
      "approval_state",
      "required_authority_role"
    ]
  },
  "execution": {
    "allowed_next_step": "revise_discount_to_policy_limit",
    "blocked_downstream_actions": [
      "create_discount_code",
      "send_discount_message"
    ],
    "execution_boundary": "Neura returns a Decision Receipt only; no discount code or customer message is created by Neura."
  },
  "trace": {
    "trace_ref": "trace_20260526_firewall_discount_001",
    "source": "github",
    "campaign": "pre_action_authority",
    "surface": "agent_action_firewall"
  },
  "boundary": {
    "downstream_execution_performed_by_neura": false,
    "real_customer_data_used": false,
    "provider_approval_claimed": false,
    "compliance_certification_claimed": false
  }
}
