{
  "receipt_id": "dr_20260526_firewall_data_export_stop_001",
  "standard": "neura-decision-receipt-v0.1-draft",
  "created_at": "2026-05-26T16:15:00-04:00",
  "action_card_id": "ac_20260526_firewall_data_export_001",
  "decision": "stop",
  "decision_reason": "Synthetic customer-record export lacks sufficient purpose, destination approval, and authority.",
  "actor": {
    "type": "agent",
    "name": "Agent Action Firewall Demo Agent",
    "runtime": "local_dry_run"
  },
  "proposed_action": {
    "action_type": "export_customer_records",
    "target": "dataset:synthetic_customer_records",
    "summary": "Export synthetic customer records to an unspecified destination.",
    "params_hash": "sha256:firewall_data_export_001",
    "amount_or_value_at_risk": "sensitive customer data class",
    "customer_impact": "possible unauthorized data movement"
  },
  "risk": {
    "risk_class": "sensitive_data_movement",
    "consequence_score": 3
  },
  "policy_basis": [
    {
      "policy_ref": "gateway.synthetic.data_export.purpose_required",
      "summary": "Customer-record exports require purpose, destination, and owner-approved authority."
    }
  ],
  "evidence_basis": [
    {
      "evidence_ref": "export_request.destination_missing",
      "summary": "Synthetic export request does not include an approved destination or purpose."
    }
  ],
  "authority": {
    "authority_ref": "data_owner",
    "approval_state": "missing",
    "required_role": "data_owner"
  },
  "validity": {
    "valid_for_action_type": "export_customer_records",
    "valid_for_target": "dataset:synthetic_customer_records",
    "params_hash": "sha256:firewall_data_export_001",
    "valid_until": null,
    "invalid_if_changed": [
      "action_type",
      "target",
      "params_hash",
      "actor",
      "policy_refs",
      "evidence_refs",
      "approval_state",
      "required_authority_role"
    ]
  },
  "execution": {
    "allowed_next_step": "do_not_execute",
    "blocked_downstream_actions": [
      "export_customer_records",
      "write_external_file",
      "send_data_to_destination"
    ],
    "execution_boundary": "Neura returns a Decision Receipt only; no data export or external destination is executed by Neura."
  },
  "trace": {
    "trace_ref": "trace_20260526_firewall_data_export_001",
    "source": "github",
    "campaign": "agent_action_gateway",
    "surface": "agent_action_firewall"
  },
  "boundary": {
    "downstream_execution_performed_by_neura": false,
    "real_customer_data_used": false,
    "provider_approval_claimed": false,
    "compliance_certification_claimed": false
  }
}
